results/best_M64_N7168_K2048.json
{
  "shape": {
    "M": 64,
    "N": 7168,
    "K": 2048
  },
  "gpu": "AMD Instinct MI355X",
  "baseline": {
    "ms": 0.013512818199215513,
    "tflops": 139.05672112935616,
    "config": {
      "BLOCK_SIZE_M": 32,
      "BLOCK_SIZE_N": 32,
      "BLOCK_SIZE_K": 512,
      "GROUP_SIZE_M": 1,
      "num_warps": 4,
      "num_stages": 2,
      "waves_per_eu": 2,
      "matrix_instr_nonkdim": 16,
      "cache_modifier": null,
      "NUM_KSPLIT": 1
    }
  },
  "best": {
    "ms": 0.015249986830310563,
    "tflops": 123.2163812932115,
    "config": {
      "BLOCK_SIZE_M": 16,
      "BLOCK_SIZE_N": 128,
      "BLOCK_SIZE_K": 256,
      "GROUP_SIZE_M": 2,
      "NUM_KSPLIT": 1,
      "num_warps": 8,
      "num_stages": 2,
      "waves_per_eu": 3,
      "matrix_instr_nonkdim": 16,
      "cache_modifier": null
    }
  },
  "speedup": 0.8860872045054957,
  "top10": [
    {
      "ms": 0.015249986830310563,
      "tflops": 123.2163812932115,
      "config": {
        "BLOCK_SIZE_M": 16,
        "BLOCK_SIZE_N": 128,
        "BLOCK_SIZE_K": 256,
        "GROUP_SIZE_M": 2,
        "NUM_KSPLIT": 1,
        "num_warps": 8,
        "num_stages": 2,
        "waves_per_eu": 3,
        "matrix_instr_nonkdim": 16,
        "cache_modifier": null
      }
    },
    {
      "ms": 0.015295289831596465,
      "tflops": 122.85142764135983,
      "config": {
        "BLOCK_SIZE_M": 16,
        "BLOCK_SIZE_N": 128,
        "BLOCK_SIZE_K": 256,
        "GROUP_SIZE_M": 2,
        "NUM_KSPLIT": 1,
        "num_warps": 8,
        "num_stages": 3,
        "waves_per_eu": 2,
        "matrix_instr_nonkdim": 16,
        "cache_modifier": null
      }
    },
    {
      "ms": 0.015356873065747064,
      "tflops": 122.3587760317657,
      "config": {
        "BLOCK_SIZE_M": 16,
        "BLOCK_SIZE_N": 256,
        "BLOCK_SIZE_K": 128,
        "GROUP_SIZE_M": 4,
        "NUM_KSPLIT": 1,
        "num_warps": 4,
        "num_stages": 2,
        "waves_per_eu": 2,
        "matrix_instr_nonkdim": 16,
        "cache_modifier": null
      }
    },
    {
      "ms": 0.015363006134211965,
      "tflops": 122.30992916259645,
      "config": {
        "BLOCK_SIZE_M": 16,
        "BLOCK_SIZE_N": 128,
        "BLOCK_SIZE_K": 256,
        "GROUP_SIZE_M": 2,
        "NUM_KSPLIT": 1,
        "num_warps": 4,
        "num_stages": 4,
        "waves_per_eu": 2,
        "matrix_instr_nonkdim": 16,
        "cache_modifier": ".cg"
      }
    },
    {
      "ms": 0.015429597288796218,
      "tflops": 121.78206318867569,
      "config": {
        "BLOCK_SIZE_M": 16,
        "BLOCK_SIZE_N": 128,
        "BLOCK_SIZE_K": 512,
        "GROUP_SIZE_M": 2,
        "NUM_KSPLIT": 1,
        "num_warps": 4,
        "num_stages": 2,
        "waves_per_eu": 2,
        "matrix_instr_nonkdim": 16,
        "cache_modifier": null
      }
    },
    {
      "ms": 0.015434471732265208,
      "tflops": 121.74360254079298,
      "config": {
        "BLOCK_SIZE_M": 16,
        "BLOCK_SIZE_N": 128,
        "BLOCK_SIZE_K": 256,
        "GROUP_SIZE_M": 2,
        "NUM_KSPLIT": 1,
        "num_warps": 4,
        "num_stages": 2,
        "waves_per_eu": 2,
        "matrix_instr_nonkdim": 16,
        "cache_modifier": null
      }
    },
    {
      "ms": 0.015575826706958479,
      "tflops": 120.63874536820174,
      "config": {
        "BLOCK_SIZE_M": 32,
        "BLOCK_SIZE_N": 128,
        "BLOCK_SIZE_K": 128,
        "GROUP_SIZE_M": 1,
        "NUM_KSPLIT": 1,
        "num_warps": 4,
        "num_stages": 2,
        "waves_per_eu": 2,
        "matrix_instr_nonkdim": 32,
        "cache_modifier": null
      }
    },
    {
      "ms": 0.015590945064120133,
      "tflops": 120.5217633871538,
      "config": {
        "BLOCK_SIZE_M": 16,
        "BLOCK_SIZE_N": 256,
        "BLOCK_SIZE_K": 128,
        "GROUP_SIZE_M": 2,
        "NUM_KSPLIT": 1,
        "num_warps": 4,
        "num_stages": 2,
        "waves_per_eu": 2,
        "matrix_instr_nonkdim": 16,
        "cache_modifier": null
      }
    },
    {
      "ms": 0.015625047955936305,
      "tflops": 120.25871519236571,
      "config": {
        "BLOCK_SIZE_M": 32,
        "BLOCK_SIZE_N": 128,
        "BLOCK_SIZE_K": 512,
        "GROUP_SIZE_M": 4,
        "NUM_KSPLIT": 1,
        "num_warps": 4,
        "num_stages": 2,
        "waves_per_eu": 2,
        "matrix_instr_nonkdim": 32,
        "cache_modifier": null
      }
    },
    {
      "ms": 0.015635675616844112,
      "tflops": 120.17697463458026,
      "config": {
        "BLOCK_SIZE_M": 16,
        "BLOCK_SIZE_N": 128,
        "BLOCK_SIZE_K": 128,
        "GROUP_SIZE_M": 2,
        "NUM_KSPLIT": 1,
        "num_warps": 4,
        "num_stages": 2,
        "waves_per_eu": 2,
        "matrix_instr_nonkdim": 16,
        "cache_modifier": null
      }
    }
  ]
}