results/best_M8_N7168_K2048.json
{
  "shape": {
    "M": 8,
    "N": 7168,
    "K": 2048
  },
  "gpu": "AMD Instinct MI355X",
  "baseline": {
    "ms": 0.041367171914316714,
    "tflops": 5.677957015928138,
    "config": {
      "BLOCK_SIZE_M": 8,
      "BLOCK_SIZE_N": 64,
      "BLOCK_SIZE_K": 512,
      "GROUP_SIZE_M": 1,
      "num_warps": 4,
      "num_stages": 2,
      "waves_per_eu": 2,
      "matrix_instr_nonkdim": 32,
      "cache_modifier": ".cg",
      "NUM_KSPLIT": 4
    }
  },
  "best": {
    "ms": 0.010577553596918643,
    "tflops": 22.205609439636724,
    "config": {
      "BLOCK_SIZE_M": 16,
      "BLOCK_SIZE_N": 128,
      "BLOCK_SIZE_K": 512,
      "GROUP_SIZE_M": 2,
      "NUM_KSPLIT": 1,
      "num_warps": 4,
      "num_stages": 2,
      "waves_per_eu": 2,
      "matrix_instr_nonkdim": 16,
      "cache_modifier": null
    }
  },
  "speedup": 3.9108449354837043,
  "top10": [
    {
      "ms": 0.010577553596918643,
      "tflops": 22.205609439636724,
      "config": {
        "BLOCK_SIZE_M": 16,
        "BLOCK_SIZE_N": 128,
        "BLOCK_SIZE_K": 512,
        "GROUP_SIZE_M": 2,
        "NUM_KSPLIT": 1,
        "num_warps": 4,
        "num_stages": 2,
        "waves_per_eu": 2,
        "matrix_instr_nonkdim": 16,
        "cache_modifier": null
      }
    },
    {
      "ms": 0.010607669555313583,
      "tflops": 22.14256607214387,
      "config": {
        "BLOCK_SIZE_M": 16,
        "BLOCK_SIZE_N": 128,
        "BLOCK_SIZE_K": 512,
        "GROUP_SIZE_M": 4,
        "NUM_KSPLIT": 1,
        "num_warps": 4,
        "num_stages": 2,
        "waves_per_eu": 2,
        "matrix_instr_nonkdim": 16,
        "cache_modifier": null
      }
    },
    {
      "ms": 0.01068004289553279,
      "tflops": 21.99251691191664,
      "config": {
        "BLOCK_SIZE_M": 16,
        "BLOCK_SIZE_N": 128,
        "BLOCK_SIZE_K": 512,
        "GROUP_SIZE_M": 1,
        "NUM_KSPLIT": 1,
        "num_warps": 8,
        "num_stages": 4,
        "waves_per_eu": 3,
        "matrix_instr_nonkdim": 16,
        "cache_modifier": null
      }
    },
    {
      "ms": 0.010832998050445226,
      "tflops": 21.681996332524644,
      "config": {
        "BLOCK_SIZE_M": 16,
        "BLOCK_SIZE_N": 128,
        "BLOCK_SIZE_K": 512,
        "GROUP_SIZE_M": 1,
        "NUM_KSPLIT": 1,
        "num_warps": 8,
        "num_stages": 4,
        "waves_per_eu": 1,
        "matrix_instr_nonkdim": 16,
        "cache_modifier": ".cg"
      }
    },
    {
      "ms": 0.01093290512341608,
      "tflops": 21.483861914884105,
      "config": {
        "BLOCK_SIZE_M": 16,
        "BLOCK_SIZE_N": 128,
        "BLOCK_SIZE_K": 256,
        "GROUP_SIZE_M": 1,
        "NUM_KSPLIT": 1,
        "num_warps": 4,
        "num_stages": 2,
        "waves_per_eu": 2,
        "matrix_instr_nonkdim": 16,
        "cache_modifier": null
      }
    },
    {
      "ms": 0.010944858130892651,
      "tflops": 21.460399138206405,
      "config": {
        "BLOCK_SIZE_M": 16,
        "BLOCK_SIZE_N": 128,
        "BLOCK_SIZE_K": 512,
        "GROUP_SIZE_M": 1,
        "NUM_KSPLIT": 1,
        "num_warps": 8,
        "num_stages": 3,
        "waves_per_eu": 1,
        "matrix_instr_nonkdim": 16,
        "cache_modifier": null
      }
    },
    {
      "ms": 0.01095709028697638,
      "tflops": 21.4364414135731,
      "config": {
        "BLOCK_SIZE_M": 16,
        "BLOCK_SIZE_N": 128,
        "BLOCK_SIZE_K": 512,
        "GROUP_SIZE_M": 1,
        "NUM_KSPLIT": 1,
        "num_warps": 8,
        "num_stages": 3,
        "waves_per_eu": 3,
        "matrix_instr_nonkdim": 16,
        "cache_modifier": ".cg"
      }
    },
    {
      "ms": 0.010962302419557526,
      "tflops": 21.426249250427137,
      "config": {
        "BLOCK_SIZE_M": 16,
        "BLOCK_SIZE_N": 128,
        "BLOCK_SIZE_K": 512,
        "GROUP_SIZE_M": 1,
        "NUM_KSPLIT": 1,
        "num_warps": 8,
        "num_stages": 4,
        "waves_per_eu": 4,
        "matrix_instr_nonkdim": 16,
        "cache_modifier": null
      }
    },
    {
      "ms": 0.010991052508377543,
      "tflops": 21.37020306480842,
      "config": {
        "BLOCK_SIZE_M": 16,
        "BLOCK_SIZE_N": 128,
        "BLOCK_SIZE_K": 512,
        "GROUP_SIZE_M": 1,
        "NUM_KSPLIT": 1,
        "num_warps": 4,
        "num_stages": 2,
        "waves_per_eu": 2,
        "matrix_instr_nonkdim": 16,
        "cache_modifier": null
      }
    },
    {
      "ms": 0.01102165741785188,
      "tflops": 21.310862340863636,
      "config": {
        "BLOCK_SIZE_M": 16,
        "BLOCK_SIZE_N": 128,
        "BLOCK_SIZE_K": 512,
        "GROUP_SIZE_M": 1,
        "NUM_KSPLIT": 1,
        "num_warps": 8,
        "num_stages": 4,
        "waves_per_eu": 2,
        "matrix_instr_nonkdim": 16,
        "cache_modifier": null
      }
    }
  ]
}