results/best_M4_N7168_K2048.json
{
  "shape": {
    "M": 4,
    "N": 7168,
    "K": 2048
  },
  "gpu": "AMD Instinct MI355X",
  "baseline": {
    "ms": 0.04040749984629014,
    "tflops": 2.9064038222296094,
    "config": {
      "BLOCK_SIZE_M": 8,
      "BLOCK_SIZE_N": 64,
      "BLOCK_SIZE_K": 512,
      "GROUP_SIZE_M": 1,
      "num_warps": 4,
      "num_stages": 2,
      "waves_per_eu": 2,
      "matrix_instr_nonkdim": 32,
      "cache_modifier": ".cg",
      "NUM_KSPLIT": 4
    }
  },
  "best": {
    "ms": 0.011190471360326606,
    "tflops": 10.49468858089034,
    "config": {
      "BLOCK_SIZE_M": 16,
      "BLOCK_SIZE_N": 128,
      "BLOCK_SIZE_K": 512,
      "GROUP_SIZE_M": 2,
      "NUM_KSPLIT": 1,
      "num_warps": 2,
      "num_stages": 3,
      "waves_per_eu": 1,
      "matrix_instr_nonkdim": 16,
      "cache_modifier": ".cg"
    }
  },
  "speedup": 3.6108845235551192,
  "top10": [
    {
      "ms": 0.011190471360326606,
      "tflops": 10.49468858089034,
      "config": {
        "BLOCK_SIZE_M": 16,
        "BLOCK_SIZE_N": 128,
        "BLOCK_SIZE_K": 512,
        "GROUP_SIZE_M": 2,
        "NUM_KSPLIT": 1,
        "num_warps": 2,
        "num_stages": 3,
        "waves_per_eu": 1,
        "matrix_instr_nonkdim": 16,
        "cache_modifier": ".cg"
      }
    },
    {
      "ms": 0.011403736099416006,
      "tflops": 10.298424216078994,
      "config": {
        "BLOCK_SIZE_M": 16,
        "BLOCK_SIZE_N": 128,
        "BLOCK_SIZE_K": 512,
        "GROUP_SIZE_M": 2,
        "NUM_KSPLIT": 1,
        "num_warps": 2,
        "num_stages": 2,
        "waves_per_eu": 4,
        "matrix_instr_nonkdim": 16,
        "cache_modifier": ".cg"
      }
    },
    {
      "ms": 0.0117214230654633,
      "tflops": 10.019304937984343,
      "config": {
        "BLOCK_SIZE_M": 16,
        "BLOCK_SIZE_N": 128,
        "BLOCK_SIZE_K": 512,
        "GROUP_SIZE_M": 2,
        "NUM_KSPLIT": 1,
        "num_warps": 2,
        "num_stages": 2,
        "waves_per_eu": 2,
        "matrix_instr_nonkdim": 16,
        "cache_modifier": ".cg"
      }
    },
    {
      "ms": 0.011878459261969308,
      "tflops": 9.886847225717533,
      "config": {
        "BLOCK_SIZE_M": 16,
        "BLOCK_SIZE_N": 128,
        "BLOCK_SIZE_K": 512,
        "GROUP_SIZE_M": 2,
        "NUM_KSPLIT": 1,
        "num_warps": 2,
        "num_stages": 2,
        "waves_per_eu": 3,
        "matrix_instr_nonkdim": 16,
        "cache_modifier": ".cg"
      }
    },
    {
      "ms": 0.01221591710364904,
      "tflops": 9.613728629913437,
      "config": {
        "BLOCK_SIZE_M": 16,
        "BLOCK_SIZE_N": 128,
        "BLOCK_SIZE_K": 512,
        "GROUP_SIZE_M": 2,
        "NUM_KSPLIT": 1,
        "num_warps": 2,
        "num_stages": 2,
        "waves_per_eu": 4,
        "matrix_instr_nonkdim": 16,
        "cache_modifier": null
      }
    },
    {
      "ms": 0.012222507708531043,
      "tflops": 9.60854472752994,
      "config": {
        "BLOCK_SIZE_M": 16,
        "BLOCK_SIZE_N": 128,
        "BLOCK_SIZE_K": 512,
        "GROUP_SIZE_M": 2,
        "NUM_KSPLIT": 1,
        "num_warps": 2,
        "num_stages": 2,
        "waves_per_eu": 3,
        "matrix_instr_nonkdim": 16,
        "cache_modifier": null
      }
    },
    {
      "ms": 0.01240631622520307,
      "tflops": 9.466187212076942,
      "config": {
        "BLOCK_SIZE_M": 16,
        "BLOCK_SIZE_N": 128,
        "BLOCK_SIZE_K": 512,
        "GROUP_SIZE_M": 2,
        "NUM_KSPLIT": 1,
        "num_warps": 2,
        "num_stages": 3,
        "waves_per_eu": 1,
        "matrix_instr_nonkdim": 16,
        "cache_modifier": null
      }
    },
    {
      "ms": 0.01264152719661416,
      "tflops": 9.290057298730066,
      "config": {
        "BLOCK_SIZE_M": 16,
        "BLOCK_SIZE_N": 64,
        "BLOCK_SIZE_K": 512,
        "GROUP_SIZE_M": 2,
        "NUM_KSPLIT": 1,
        "num_warps": 2,
        "num_stages": 4,
        "waves_per_eu": 2,
        "matrix_instr_nonkdim": 16,
        "cache_modifier": ".cg"
      }
    },
    {
      "ms": 0.012759513127679941,
      "tflops": 9.204153075812085,
      "config": {
        "BLOCK_SIZE_M": 16,
        "BLOCK_SIZE_N": 64,
        "BLOCK_SIZE_K": 512,
        "GROUP_SIZE_M": 2,
        "NUM_KSPLIT": 1,
        "num_warps": 2,
        "num_stages": 4,
        "waves_per_eu": 4,
        "matrix_instr_nonkdim": 16,
        "cache_modifier": null
      }
    },
    {
      "ms": 0.012816014331349284,
      "tflops": 9.16357527103637,
      "config": {
        "BLOCK_SIZE_M": 16,
        "BLOCK_SIZE_N": 64,
        "BLOCK_SIZE_K": 512,
        "GROUP_SIZE_M": 2,
        "NUM_KSPLIT": 1,
        "num_warps": 4,
        "num_stages": 1,
        "waves_per_eu": 1,
        "matrix_instr_nonkdim": 16,
        "cache_modifier": null
      }
    }
  ]
}