results/best_M1_N7168_K2048.json
{
  "shape": {
    "M": 1,
    "N": 7168,
    "K": 2048
  },
  "gpu": "AMD Instinct MI355X",
  "baseline": {
    "ms": 0.04007252771407366,
    "tflops": 0.7326747194359937,
    "config": {
      "BLOCK_SIZE_M": 8,
      "BLOCK_SIZE_N": 64,
      "BLOCK_SIZE_K": 512,
      "GROUP_SIZE_M": 1,
      "num_warps": 4,
      "num_stages": 2,
      "waves_per_eu": 2,
      "matrix_instr_nonkdim": 32,
      "cache_modifier": ".cg",
      "NUM_KSPLIT": 4
    }
  },
  "best": {
    "ms": 0.010722361920976795,
    "tflops": 2.738214603870164,
    "config": {
      "BLOCK_SIZE_M": 16,
      "BLOCK_SIZE_N": 256,
      "BLOCK_SIZE_K": 512,
      "GROUP_SIZE_M": 2,
      "NUM_KSPLIT": 1,
      "num_warps": 4,
      "num_stages": 2,
      "waves_per_eu": 2,
      "matrix_instr_nonkdim": 16,
      "cache_modifier": null
    }
  },
  "speedup": 3.7372854982331263,
  "top10": [
    {
      "ms": 0.010722361920976795,
      "tflops": 2.738214603870164,
      "config": {
        "BLOCK_SIZE_M": 16,
        "BLOCK_SIZE_N": 256,
        "BLOCK_SIZE_K": 512,
        "GROUP_SIZE_M": 2,
        "NUM_KSPLIT": 1,
        "num_warps": 4,
        "num_stages": 2,
        "waves_per_eu": 2,
        "matrix_instr_nonkdim": 16,
        "cache_modifier": null
      }
    },
    {
      "ms": 0.010832130634025742,
      "tflops": 2.7104665731942306,
      "config": {
        "BLOCK_SIZE_M": 16,
        "BLOCK_SIZE_N": 256,
        "BLOCK_SIZE_K": 512,
        "GROUP_SIZE_M": 1,
        "NUM_KSPLIT": 1,
        "num_warps": 4,
        "num_stages": 2,
        "waves_per_eu": 2,
        "matrix_instr_nonkdim": 16,
        "cache_modifier": null
      }
    },
    {
      "ms": 0.011087608233619926,
      "tflops": 2.6480127527390454,
      "config": {
        "BLOCK_SIZE_M": 16,
        "BLOCK_SIZE_N": 256,
        "BLOCK_SIZE_K": 256,
        "GROUP_SIZE_M": 1,
        "NUM_KSPLIT": 1,
        "num_warps": 4,
        "num_stages": 2,
        "waves_per_eu": 2,
        "matrix_instr_nonkdim": 16,
        "cache_modifier": null
      }
    },
    {
      "ms": 0.011222970433014094,
      "tflops": 2.6160746101257355,
      "config": {
        "BLOCK_SIZE_M": 16,
        "BLOCK_SIZE_N": 256,
        "BLOCK_SIZE_K": 256,
        "GROUP_SIZE_M": 2,
        "NUM_KSPLIT": 1,
        "num_warps": 4,
        "num_stages": 2,
        "waves_per_eu": 2,
        "matrix_instr_nonkdim": 16,
        "cache_modifier": null
      }
    },
    {
      "ms": 0.011660583850428246,
      "tflops": 2.5178951908931837,
      "config": {
        "BLOCK_SIZE_M": 16,
        "BLOCK_SIZE_N": 256,
        "BLOCK_SIZE_K": 512,
        "GROUP_SIZE_M": 4,
        "NUM_KSPLIT": 1,
        "num_warps": 4,
        "num_stages": 2,
        "waves_per_eu": 2,
        "matrix_instr_nonkdim": 16,
        "cache_modifier": null
      }
    },
    {
      "ms": 0.01179958304772253,
      "tflops": 2.4882343622867995,
      "config": {
        "BLOCK_SIZE_M": 16,
        "BLOCK_SIZE_N": 256,
        "BLOCK_SIZE_K": 256,
        "GROUP_SIZE_M": 4,
        "NUM_KSPLIT": 1,
        "num_warps": 4,
        "num_stages": 2,
        "waves_per_eu": 2,
        "matrix_instr_nonkdim": 16,
        "cache_modifier": null
      }
    },
    {
      "ms": 0.011983229546999,
      "tflops": 2.450101442590888,
      "config": {
        "BLOCK_SIZE_M": 16,
        "BLOCK_SIZE_N": 256,
        "BLOCK_SIZE_K": 512,
        "GROUP_SIZE_M": 2,
        "NUM_KSPLIT": 1,
        "num_warps": 8,
        "num_stages": 2,
        "waves_per_eu": 2,
        "matrix_instr_nonkdim": 16,
        "cache_modifier": ".cg"
      }
    },
    {
      "ms": 0.012039402120830689,
      "tflops": 2.438669936042823,
      "config": {
        "BLOCK_SIZE_M": 16,
        "BLOCK_SIZE_N": 256,
        "BLOCK_SIZE_K": 512,
        "GROUP_SIZE_M": 1,
        "NUM_KSPLIT": 1,
        "num_warps": 8,
        "num_stages": 2,
        "waves_per_eu": 4,
        "matrix_instr_nonkdim": 16,
        "cache_modifier": ".cg"
      }
    },
    {
      "ms": 0.012093135014682718,
      "tflops": 2.4278343013910613,
      "config": {
        "BLOCK_SIZE_M": 16,
        "BLOCK_SIZE_N": 256,
        "BLOCK_SIZE_K": 512,
        "GROUP_SIZE_M": 1,
        "NUM_KSPLIT": 1,
        "num_warps": 8,
        "num_stages": 2,
        "waves_per_eu": 3,
        "matrix_instr_nonkdim": 16,
        "cache_modifier": ".cg"
      }
    },
    {
      "ms": 0.012150537740525644,
      "tflops": 2.4163644957107766,
      "config": {
        "BLOCK_SIZE_M": 16,
        "BLOCK_SIZE_N": 256,
        "BLOCK_SIZE_K": 512,
        "GROUP_SIZE_M": 1,
        "NUM_KSPLIT": 1,
        "num_warps": 8,
        "num_stages": 2,
        "waves_per_eu": 2,
        "matrix_instr_nonkdim": 16,
        "cache_modifier": ".cg"
      }
    }
  ]
}